{
  "$schema": "../../schema/security-template.schema.json",
  "name": "Compliance Gap Analysis",
  "description": "Identifies gaps between current security controls and compliance framework requirements. Supports ISO 27001, NIST CSF 2.0, SOC 2, CIS Controls v8, and CMMC. Generates remediation roadmap with effort estimates.",
  "version": "2026.3.2",
  "author": { "name": "SecureYeoman Community", "github": "MacCracken" },
  "category": "security",
  "tags": ["compliance", "iso-27001", "nist-csf", "soc2", "gap-analysis", "audit", "security-template"],
  "requiredIntegrations": [],
  "autonomyLevel": "L1",
  "outputFormat": "markdown"
}
